{
  "schemaVersion": "acq-neutral-model-catalog/v1",
  "providerId": "usai",
  "models": [
    {
      "id": "claude-sonnet-5.5",
      "name": "Claude Sonnet 5.5",
      "contextWindow": 1000000,
      "maxOutputTokens": 128000,
      "cost": {
        "input": 2,
        "output": 10,
        "cacheRead": 0.1,
        "cacheWrite": 2.5
      }
    },
    {
      "id": "claude-opus-5",
      "name": "Claude Opus 5",
      "contextWindow": 1000000,
      "maxOutputTokens": 128000,
      "cost": {
        "input": 5,
        "output": 25,
        "cacheRead": 0.5,
        "cacheWrite": 6.25
      }
    },
    {
      "id": "claude-sonnet-5",
      "name": "Claude Sonnet 5",
      "contextWindow": 1000000,
      "maxOutputTokens": 128000,
      "cost": {
        "input": 2,
        "output": 10,
        "cacheRead": 0.2,
        "cacheWrite": 2.5
      }
    },
    {
      "id": "claude_4_8_opus",
      "name": "Claude 4.8 Opus",
      "contextWindow": 1000000,
      "maxOutputTokens": 128000,
      "cost": {
        "input": 5,
        "output": 25,
        "cacheRead": 0.5,
        "cacheWrite": 6.25
      }
    },
    {
      "id": "claude_4_7_opus",
      "name": "Claude 4.7 Opus",
      "contextWindow": 1000000,
      "maxOutputTokens": 128000,
      "cost": {
        "input": 5,
        "output": 25,
        "cacheRead": 0.5,
        "cacheWrite": 6.25
      }
    },
    {
      "id": "claude_4_6_sonnet",
      "name": "Claude 4.6 Sonnet",
      "contextWindow": 1000000,
      "maxOutputTokens": 128000,
      "cost": {
        "input": 3.3,
        "output": 16.5,
        "cacheRead": 0.33,
        "cacheWrite": 4.125
      }
    },
    {
      "id": "claude_4_5_haiku",
      "name": "Claude 4.5 Haiku",
      "contextWindow": 200000,
      "maxOutputTokens": 64000,
      "cost": {
        "input": 1,
        "output": 5,
        "cacheRead": 0.1,
        "cacheWrite": 1.25
      }
    },
    {
      "id": "claude_4_5_sonnet",
      "name": "Claude 4.5 Sonnet",
      "contextWindow": 200000,
      "maxOutputTokens": 64000,
      "cost": {
        "input": 3,
        "output": 15,
        "cacheRead": 0.3,
        "cacheWrite": 3.75
      }
    },
    {
      "id": "gpt-6.1-sol-latest-guardrails-defaultv2",
      "name": "GPT 6.1 Sol Latest Guardrails Defaultv2",
      "contextWindow": 1050000,
      "maxOutputTokens": 128000,
      "cost": {
        "input": 2,
        "output": 10,
        "cacheRead": 0.1,
        "cacheWrite": 2.5
      },
      "costAbove200kContext": {
        "input": 4,
        "output": 15,
        "cacheRead": 0.2,
        "cacheWrite": 5
      }
    },
    {
      "id": "gpt-6-astra",
      "name": "GPT 6 Astra",
      "contextWindow": 1050000,
      "maxOutputTokens": 128000,
      "cost": {
        "input": 10,
        "output": 50,
        "cacheRead": 1,
        "cacheWrite": 12.5
      },
      "costAbove200kContext": {
        "input": 20,
        "output": 75,
        "cacheRead": 2,
        "cacheWrite": 25
      }
    },
    {
      "id": "gpt-6-luna",
      "name": "GPT 6 Luna",
      "contextWindow": 1050000,
      "maxOutputTokens": 128000,
      "cost": {
        "input": 0.1,
        "output": 0.5,
        "cacheRead": 0.01,
        "cacheWrite": 0.125
      },
      "costAbove200kContext": {
        "input": 0.2,
        "output": 0.75,
        "cacheRead": 0.02,
        "cacheWrite": 0.25
      }
    },
    {
      "id": "gpt-6-sol-latest-guardrails-defaultv2",
      "name": "GPT 6 Sol Latest Guardrails Defaultv2",
      "contextWindow": 1050000,
      "maxOutputTokens": 128000,
      "cost": {
        "input": 2,
        "output": 10,
        "cacheRead": 0.2,
        "cacheWrite": 2.5
      },
      "costAbove200kContext": {
        "input": 4,
        "output": 15,
        "cacheRead": 0.4,
        "cacheWrite": 5
      }
    },
    {
      "id": "gpt-5.6-luna",
      "name": "GPT 5.6 Luna",
      "contextWindow": 1050000,
      "maxOutputTokens": 128000,
      "cost": {
        "input": 0.2,
        "output": 1.2,
        "cacheRead": 0.02,
        "cacheWrite": 0.25
      },
      "costAbove200kContext": {
        "input": 0.4,
        "output": 1.8,
        "cacheRead": 0.04,
        "cacheWrite": 0.5
      }
    },
    {
      "id": "gpt-5.6-sol-latest-guardrails-defaultv2",
      "name": "GPT 5.6 Sol Latest Guardrails Defaultv2",
      "contextWindow": 1050000,
      "maxOutputTokens": 128000,
      "cost": {
        "input": 4,
        "output": 20,
        "cacheRead": 0.4,
        "cacheWrite": 5
      },
      "costAbove200kContext": {
        "input": 8,
        "output": 30,
        "cacheRead": 0.8,
        "cacheWrite": 10
      }
    },
    {
      "id": "gpt-5.6-terra",
      "name": "GPT 5.6 Terra",
      "contextWindow": 1050000,
      "maxOutputTokens": 128000,
      "cost": {
        "input": 2,
        "output": 12,
        "cacheRead": 0.2,
        "cacheWrite": 2.5
      },
      "costAbove200kContext": {
        "input": 4,
        "output": 18,
        "cacheRead": 0.4,
        "cacheWrite": 5
      }
    },
    {
      "id": "gpt_5_5_default_v2",
      "name": "GPT 5.5 Default V2",
      "contextWindow": 1050000,
      "maxOutputTokens": 128000,
      "cost": {
        "input": 5,
        "output": 30,
        "cacheRead": 0.5
      },
      "costAbove200kContext": {
        "input": 10,
        "output": 45,
        "cacheRead": 1
      }
    },
    {
      "id": "gpt_5_4_default_v2",
      "name": "GPT 5.4 Default V2",
      "contextWindow": 1050000,
      "maxOutputTokens": 128000,
      "cost": {
        "input": 2.5,
        "output": 15,
        "cacheRead": 0.25
      },
      "costAbove200kContext": {
        "input": 5,
        "output": 22.5,
        "cacheRead": 0.5
      }
    },
    {
      "id": "gpt_5_2_default_v2",
      "name": "GPT 5.2 Default V2",
      "contextWindow": 400000,
      "maxOutputTokens": 128000,
      "cost": {
        "input": 1.75,
        "output": 14,
        "cacheRead": 0.175
      }
    },
    {
      "id": "gemini-3.8-flash",
      "name": "Gemini 3.8 Flash",
      "contextWindow": 1048576,
      "maxOutputTokens": 65536,
      "cost": {
        "input": 0.75,
        "output": 3.75,
        "cacheRead": 0.075
      }
    },
    {
      "id": "gemini-3-7-flash",
      "name": "Gemini 3.7 Flash",
      "contextWindow": 1048576,
      "maxOutputTokens": 65536,
      "cost": {
        "input": 0.75,
        "output": 3.75,
        "cacheRead": 0.075
      }
    },
    {
      "id": "gemini-3.5-flash",
      "name": "Gemini 3.5 Flash",
      "contextWindow": 1048576,
      "maxOutputTokens": 65536,
      "cost": {
        "input": 1.5,
        "output": 9,
        "cacheRead": 0.15
      }
    },
    {
      "id": "gemini-2.5-flash",
      "name": "Gemini 2.5 Flash",
      "contextWindow": 1048576,
      "maxOutputTokens": 65536,
      "cost": {
        "input": 0.3,
        "output": 2.5,
        "cacheRead": 0.03
      }
    },
    {
      "id": "gemini-2.5-flash-lite",
      "name": "Gemini 2.5 Flash Lite",
      "contextWindow": 1048576,
      "maxOutputTokens": 65536,
      "cost": {
        "input": 0.1,
        "output": 0.4,
        "cacheRead": 0.01
      }
    },
    {
      "id": "llama_4_maverick",
      "name": "Llama 4 Maverick",
      "contextWindow": 1000000,
      "maxOutputTokens": 8192,
      "cost": {
        "input": 0.24,
        "output": 0.97
      }
    }
  ],
  "recommendations": {
    "primary": "claude-sonnet-5",
    "small": "claude_4_5_haiku",
    "compaction": "gpt-5.6-terra",
    "summary": "gpt_5_2_default_v2",
    "title": "gpt_5_2_default_v2"
  }
}
